id,subject,description
1,App não abre,"O aplicativo trava e fecha sozinho toda vez que tento abrir. Está parado, não consigo trabalhar. Urgente!"
2,Dúvida sobre relatório,"Como faço para exportar o relatório mensal em PDF? Onde fica essa opção?"
3,Cobrança indevida,"Fui cobrado duas vezes na fatura deste mês no cartão. Solicito o reembolso do valor duplicado."
4,Sugestão de recurso,"Gostaria que o sistema permitisse adicionar tags nos tickets. Seria um recurso muito útil."
5,Péssimo atendimento,"Estou muito insatisfeito com o suporte. Quero cancelar minha assinatura imediatamente."
6,Erro ao salvar,"Aparece uma falha quando clico em salvar. O botão não funciona e perco os dados."
7,Como alterar senha,"Sem pressa, mas gostaria de saber onde altero minha senha de acesso."
8,Integração parada,"A integração com o gateway de pagamento está bloqueada em produção. Preciso resolver o quanto antes."
